{
  "id": "base:settlement_type/village",
  "inhabited": false,
  "rarity": 10,
  "danger": { "min": 1, "max": 10 },
  "structures": [
    { "structure": "base:structure/house_small", "count": { "min": 3, "max": 5 } },
    { "structure": "base:structure/house_family", "count": { "min": 1, "max": 2 } },
    { "structure": "base:structure/garage", "count": { "min": 1, "max": 1 } }
  ],
  "areaTypes": [
    { "areaType": "base:area_type/kitchen", "weight": 4 },
    { "areaType": "base:area_type/bedroom", "weight": 5 },
    { "areaType": "base:area_type/bathroom", "weight": 2 }
  ],
  "zombieSpawns": [
    { "zombieType": "base:zombie/walker", "count": { "min": 3, "max": 8 } }
  ]
}
